{"$id":"https://surfaces.dev/schemas/surfaceops-kanban-live/surfaceops-kanban-live-evidence.v0.schema.json","$schema":"https://json-schema.org/draft/2020-12/schema","additionalProperties":false,"properties":{"args":{"additionalProperties":true,"type":"object"},"artifacts":{"items":{"additionalProperties":false,"properties":{"hash":{"pattern":"^[0-9a-f]{64}$","type":"string"},"hashAlgorithm":{"const":"sha256"},"path":{"type":"string"},"schemaId":{"type":"string"},"sourceEvidenceHash":{"pattern":"^[0-9a-f]{64}$","type":"string"},"sourceRef":{"type":["string","null"]}},"required":["path","schemaId","hashAlgorithm","hash","sourceRef"],"type":"object"},"type":"array"},"boundaryRefs":{"items":{"additionalProperties":false,"properties":{"hash":{"pattern":"^[0-9a-f]{64}$","type":"string"},"hashAlgorithm":{"const":"sha256"},"path":{"type":"string"},"schemaId":{"type":"string"},"sourceEvidenceHash":{"pattern":"^[0-9a-f]{64}$","type":"string"},"sourceRef":{"type":["string","null"]}},"required":["path","schemaId","hashAlgorithm","hash","sourceRef"],"type":"object"},"type":"array"},"checkedAt":{"const":"1970-01-01T00:00:00.000Z"},"command":{"const":"interfacectl surfaces surfaceops-kanban-live proof"},"contractId":{"const":"surfaceops-kanban-live-proof"},"diagnostics":{"items":{"additionalProperties":false,"properties":{"artifactPath":{"type":"string"},"canonicalMessage":{"type":"string"},"code":{"type":"string"},"fixtureCoverage":{"type":"string"},"jsonPointer":{"type":"string"},"message":{"type":"string"},"phase":{"type":"string"},"promotionStatus":{"enum":["allowed","blocked","review_required"]},"severity":{"enum":["error","warning","review"]},"sourceRef":{"type":["string","null"]},"stage":{"type":"string"},"suggestedAction":{"type":"string"},"trigger":{"type":"string"},"validationResult":{"enum":["valid","invalid","review_required"]}},"required":["code","trigger","canonicalMessage","message","severity","stage","phase","validationResult","promotionStatus","artifactPath","jsonPointer","sourceRef","fixtureCoverage","suggestedAction"],"type":"object"},"type":"array"},"diagnosticsRegistry":{"items":{"additionalProperties":false,"properties":{"artifactPath":{"type":"string"},"canonicalMessage":{"type":"string"},"code":{"type":"string"},"fixtureCoverage":{"type":"string"},"jsonPointer":{"type":"string"},"message":{"type":"string"},"phase":{"type":"string"},"promotionStatus":{"enum":["allowed","blocked","review_required"]},"severity":{"enum":["error","warning","review"]},"sourceRef":{"type":["string","null"]},"stage":{"type":"string"},"suggestedAction":{"type":"string"},"trigger":{"type":"string"},"validationResult":{"enum":["valid","invalid","review_required"]}},"required":["code","trigger","canonicalMessage","message","severity","stage","phase","validationResult","promotionStatus","artifactPath","jsonPointer","sourceRef","fixtureCoverage","suggestedAction"],"type":"object"},"type":"array"},"environment":{"additionalProperties":false,"properties":{"generatedAt":{"const":"1970-01-01T00:00:00.000Z"},"host":{"type":"null"}},"required":["generatedAt","host"],"type":"object"},"fixtureRefs":{"items":{"additionalProperties":false,"properties":{"hash":{"pattern":"^[0-9a-f]{64}$","type":"string"},"hashAlgorithm":{"const":"sha256"},"path":{"type":"string"},"schemaId":{"type":"string"},"sourceEvidenceHash":{"pattern":"^[0-9a-f]{64}$","type":"string"},"sourceRef":{"type":["string","null"]}},"required":["path","schemaId","hashAlgorithm","hash","sourceRef"],"type":"object"},"type":"array"},"promotionStatus":{"enum":["allowed","review_required","blocked"]},"provenance":{"additionalProperties":false,"properties":{"generatedAt":{"const":"1970-01-01T00:00:00.000Z"},"generator":{"type":"string"},"sourceRefs":{"items":{"type":"string"},"type":"array"}},"required":["generatedAt","generator","sourceRefs"],"type":"object"},"runId":{"type":"string"},"schemaClosure":{"items":{"additionalProperties":false,"properties":{"hash":{"pattern":"^[0-9a-f]{64}$","type":"string"},"hashAlgorithm":{"const":"sha256"},"path":{"type":"string"},"schemaId":{"type":"string"},"sourceEvidenceHash":{"pattern":"^[0-9a-f]{64}$","type":"string"},"sourceRef":{"type":["string","null"]}},"required":["path","schemaId","hashAlgorithm","hash","sourceRef"],"type":"object"},"type":"array"},"schemaId":{"const":"surfaceops-kanban-live-evidence.v0"},"status":{"enum":["pass","fail"]},"targetId":{"const":"surfaceops-kanban-live"},"validationResults":{"items":{"additionalProperties":false,"properties":{"actualResult":{"enum":["valid","invalid","review_required"]},"diagnosticCodes":{"items":{"type":"string"},"type":"array"},"expectedDiagnosticCodes":{"items":{"type":"string"},"type":"array"},"expectedResult":{"enum":["valid","invalid","review_required"]},"fixturePath":{"type":"string"},"matched":{"type":"boolean"},"promotionStatus":{"enum":["allowed","blocked","review_required"]}},"required":["fixturePath","expectedResult","actualResult","promotionStatus","expectedDiagnosticCodes","diagnosticCodes","matched"],"type":"object"},"type":"array"},"version":{"const":"0.0.0"}},"required":["schemaId","version","runId","contractId","targetId","status","promotionStatus","command","args","checkedAt","environment","schemaClosure","fixtureRefs","boundaryRefs","artifacts","validationResults","diagnostics","diagnosticsRegistry","provenance"],"type":"object"}