{"args":{"decisionLedger":"artifacts/p4/surfaceops-decision-ledger.json","evaluationReport":"artifacts/p4/judgmentkit-evaluation-report.json","fixture":"fixtures/surfaceops-kanban-live","kanbanApiManifest":"sources/surfaceops-kanban-live/kanban-cards-api-manifest.json","orchestrationEvidence":"artifacts/p3/evidence.json","orchestrationReport":"artifacts/p3/agent-orchestration-report.json","out":"artifacts/surfaceops-kanban-live","reviewEvidence":"artifacts/p4/evidence.json","reviewQueue":"artifacts/p3/review-queue.json","reviewReport":"artifacts/p4/review-judgment-report.json"},"artifacts":[{"hash":"ef5b6a63ef5d2d51108bb41429957c0a878372b735d67b1b7ff839c3956867ce","hashAlgorithm":"sha256","path":"artifacts/surfaceops-kanban-live/surfaceops-kanban-live-target-selection.json","schemaId":"surfaceops-kanban-live-target-selection.v0","sourceRef":null},{"hash":"b79b4b924ae333ad43d3f28d262c9dc0233db5b8edf20f81ed8ce30ad0bbbe0d","hashAlgorithm":"sha256","path":"artifacts/surfaceops-kanban-live/surfaceops-kanban-live-api-projection.json","schemaId":"kanban-cards-api-manifest.v0","sourceRef":null},{"hash":"e35f01528cde39132204053143730254812a36d9f39adec68e0be2d641da9d7b","hashAlgorithm":"sha256","path":"artifacts/surfaceops-kanban-live/surfaceops-kanban-live-operation-plan.json","schemaId":"surfaceops-kanban-live-operation-plan.v0","sourceRef":null},{"hash":"08e3bacf71c6b6fddb5bdf6be2bb9daec74bd2ef94516d0469244d5eb33338b5","hashAlgorithm":"sha256","path":"artifacts/surfaceops-kanban-live/surfaceops-kanban-live-handoff-record.json","schemaId":"surfaceops-kanban-live-handoff-record.v0","sourceRef":null},{"hash":"e128f3104be37ea2d8e89de3e209a6801bde0b51a7b1c3bf64cbd6366b582b89","hashAlgorithm":"sha256","path":"artifacts/surfaceops-kanban-live/surfaceops-kanban-live-adapter-report.json","schemaId":"surfaceops-kanban-live-adapter-report.v0","sourceRef":null},{"hash":"394d6d84835bc5bfd27eb114838f392b637638ed5d05277e7fce71a92d7a52f3","hashAlgorithm":"sha256","path":"artifacts/surfaceops-kanban-live/evidence.json","schemaId":"surfaceops-kanban-live-evidence.v0","sourceRef":null}],"boundaryRefs":[{"hash":"0438bb49b2b23197e79b60a5325a5061e066179a42bf4b013c5fcfdece16b4d5","hashAlgorithm":"sha256","path":"sources/surfaceops-kanban-live/kanban-cards-api-manifest.json","schemaId":"kanban-cards-api-manifest.v0","sourceRef":null},{"hash":"08c4c9e62c8643e7427b60f1ad8e48c86cfa5fced0ad1e0d3b6c3e0e5025589c","hashAlgorithm":"sha256","path":"artifacts/p3/evidence.json","schemaId":"agent-orchestration-evidence.v0","sourceRef":null},{"hash":"aac26d2171acaaabbe27c6262d45575eac8bf08c6e6a5284c1340cec184694da","hashAlgorithm":"sha256","path":"artifacts/p3/review-queue.json","schemaId":"agent-review-queue.v0","sourceEvidenceHash":"08c4c9e62c8643e7427b60f1ad8e48c86cfa5fced0ad1e0d3b6c3e0e5025589c","sourceRef":null},{"hash":"a15550b663925ffeedb30c29b217f778aa5cb4b78d50bc2ba9f3b3ce81700cfc","hashAlgorithm":"sha256","path":"artifacts/p3/agent-orchestration-report.json","schemaId":"agent-orchestration-report.v0","sourceEvidenceHash":"08c4c9e62c8643e7427b60f1ad8e48c86cfa5fced0ad1e0d3b6c3e0e5025589c","sourceRef":null},{"hash":"a9de1573bc5c4dcd9e0d509d8b60885470a4d6cb2bfcbc0eff5ed451997d71f3","hashAlgorithm":"sha256","path":"artifacts/p4/evidence.json","schemaId":"review-judgment-evidence.v0","sourceRef":null},{"hash":"91dd2b08dc7c99f2ff28c6dca2862379269f0f89c7feb63a073bd51fc5f1ebb8","hashAlgorithm":"sha256","path":"artifacts/p4/surfaceops-decision-ledger.json","schemaId":"surfaceops-decision-ledger.v0","sourceEvidenceHash":"a9de1573bc5c4dcd9e0d509d8b60885470a4d6cb2bfcbc0eff5ed451997d71f3","sourceRef":null},{"hash":"ca31dcd66c7037e0b8eff4e24ad5a41ae99497d7a44bc7a558f85bd981f32add","hashAlgorithm":"sha256","path":"artifacts/p4/review-judgment-report.json","schemaId":"review-judgment-report.v0","sourceEvidenceHash":"a9de1573bc5c4dcd9e0d509d8b60885470a4d6cb2bfcbc0eff5ed451997d71f3","sourceRef":null},{"hash":"f792803e20a7bca5e235ab332b8b264e3a284bd4d93ba1abc1227582de889243","hashAlgorithm":"sha256","path":"artifacts/p4/judgmentkit-evaluation-report.json","schemaId":"judgmentkit-evaluation-report.v0","sourceEvidenceHash":"a9de1573bc5c4dcd9e0d509d8b60885470a4d6cb2bfcbc0eff5ed451997d71f3","sourceRef":null}],"checkedAt":"1970-01-01T00:00:00.000Z","command":"interfacectl surfaces surfaceops-kanban-live proof","contractId":"surfaceops-kanban-live-proof","diagnostics":[{"artifactPath":"fixtures/surfaceops-kanban-live/mutations/api-manifest-hash-mismatch.surfaceops-kanban-live-preflight.json","canonicalMessage":"kanban.cards API manifest hash does not match the declared live boundary.","code":"SURFACEOPS_KANBAN_LIVE_API_MANIFEST_HASH_MISMATCH","fixtureCoverage":"mutations/api-manifest-hash-mismatch.surfaceops-kanban-live-preflight.json","jsonPointer":"/apiManifestRef/hash","message":"kanban.cards API manifest hash does not match the declared live boundary.","phase":"surfaceops-kanban-live-api-boundary","promotionStatus":"blocked","severity":"error","sourceRef":null,"stage":"api-boundary","suggestedAction":"Use the SurfaceOps-owned adapter boundary and regenerate live proof evidence after correcting the integration issue.","trigger":"kanban.cards API manifest hash does not match the declared live boundary.","validationResult":"invalid"},{"artifactPath":"fixtures/surfaceops-kanban-live/mutations/missing-api-manifest.surfaceops-kanban-live-preflight.json","canonicalMessage":"kanban.cards API manifest is missing.","code":"SURFACEOPS_KANBAN_LIVE_API_MANIFEST_MISSING","fixtureCoverage":"mutations/missing-api-manifest.surfaceops-kanban-live-preflight.json","jsonPointer":"/apiManifestRef","message":"kanban.cards API manifest is missing.","phase":"surfaceops-kanban-live-api-boundary","promotionStatus":"blocked","severity":"error","sourceRef":null,"stage":"api-boundary","suggestedAction":"Use the SurfaceOps-owned adapter boundary and regenerate live proof evidence after correcting the integration issue.","trigger":"kanban.cards API manifest is missing.","validationResult":"invalid"},{"artifactPath":"fixtures/surfaceops-kanban-live/invalid/authority-override.surfaceops-kanban-live.json","canonicalMessage":"kanban.cards must not override SurfaceOps or Surfaces authority.","code":"SURFACEOPS_KANBAN_LIVE_AUTHORITY_OVERRIDE","fixtureCoverage":"invalid/authority-override.surfaceops-kanban-live.json","jsonPointer":"/authority","message":"kanban.cards must not override SurfaceOps or Surfaces authority.","phase":"surfaceops-kanban-live-authority","promotionStatus":"blocked","severity":"error","sourceRef":"fixture://surfaceops-kanban-live/invalid/authority-override#/authority","stage":"authority","suggestedAction":"Use the SurfaceOps-owned adapter boundary and regenerate live proof evidence after correcting the integration issue.","trigger":"kanban.cards must not override SurfaceOps or Surfaces authority.","validationResult":"invalid"},{"artifactPath":"fixtures/surfaceops-kanban-live/invalid/conflict-silent-overwrite.surfaceops-kanban-live.json","canonicalMessage":"Divergent kanban state must create a conflict instead of silent overwrite.","code":"SURFACEOPS_KANBAN_LIVE_CONFLICT_REQUIRED","fixtureCoverage":"invalid/conflict-silent-overwrite.surfaceops-kanban-live.json","jsonPointer":"/conflictPolicy","message":"Divergent kanban state must create a conflict instead of silent overwrite.","phase":"surfaceops-kanban-live-conflict","promotionStatus":"blocked","severity":"error","sourceRef":"fixture://surfaceops-kanban-live/invalid/conflict-silent-overwrite#/conflictPolicy","stage":"conflict","suggestedAction":"Use the SurfaceOps-owned adapter boundary and regenerate live proof evidence after correcting the integration issue.","trigger":"Divergent kanban state must create a conflict instead of silent overwrite.","validationResult":"invalid"},{"artifactPath":"fixtures/surfaceops-kanban-live/mutations/hash-mismatch.surfaceops-kanban-live-evidence.json","canonicalMessage":"Live kanban evidence hash does not match the evidence manifest.","code":"SURFACEOPS_KANBAN_LIVE_EVIDENCE_HASH_MISMATCH","fixtureCoverage":"mutations/hash-mismatch.surfaceops-kanban-live-evidence.json","jsonPointer":"/artifacts","message":"Live kanban evidence hash does not match the evidence manifest.","phase":"surfaceops-kanban-live-evidence","promotionStatus":"blocked","severity":"error","sourceRef":null,"stage":"evidence","suggestedAction":"Use the SurfaceOps-owned adapter boundary and regenerate live proof evidence after correcting the integration issue.","trigger":"Live kanban evidence hash does not match the evidence manifest.","validationResult":"invalid"},{"artifactPath":"fixtures/surfaceops-kanban-live/invalid/missing-evidence-ref.surfaceops-kanban-live.json","canonicalMessage":"Live kanban operation requires exact SurfaceOps evidence references.","code":"SURFACEOPS_KANBAN_LIVE_EVIDENCE_REF_MISSING","fixtureCoverage":"invalid/missing-evidence-ref.surfaceops-kanban-live.json","jsonPointer":"/evidenceRefs","message":"Live kanban operation requires exact SurfaceOps evidence references.","phase":"surfaceops-kanban-live-operation-plan","promotionStatus":"blocked","severity":"error","sourceRef":"fixture://surfaceops-kanban-live/invalid/missing-evidence-ref#/evidenceRefs","stage":"operation-plan","suggestedAction":"Use the SurfaceOps-owned adapter boundary and regenerate live proof evidence after correcting the integration issue.","trigger":"Live kanban operation requires exact SurfaceOps evidence references.","validationResult":"invalid"},{"artifactPath":"fixtures/surfaceops-kanban-live/invalid/idempotency-missing.surfaceops-kanban-live.json","canonicalMessage":"Adapter operations require deterministic idempotency keys.","code":"SURFACEOPS_KANBAN_LIVE_IDEMPOTENCY_REQUIRED","fixtureCoverage":"invalid/idempotency-missing.surfaceops-kanban-live.json","jsonPointer":"/operations","message":"Adapter operations require deterministic idempotency keys.","phase":"surfaceops-kanban-live-idempotency","promotionStatus":"blocked","severity